Nightcall Kavinsky music video,8k2AMDvugzw
Chaeri Magdalena Bay music video,ben9qDbrLYU
Polozhenie - Zedline Remix Zedline music video,pVjdMQ_iAh0
Nightmare Nyxen music video,4136AwqMjiA
CURSED ALEX TOKYO ROSE THE AKUMA WVLFPAKT Mecha Maiko music video,wfeKcWXEk1M
Endless Love DVRST OBLXKQ music video,fC1HF29n9UA
Shinigami Eyes Grimes music video,pzPElFdxMCM
After Dark Mr.Kitty music video,jEcDeP8X6-s
Dream Steppin' Two People music video,3TRNoz6jyZk
Dark Angel Provoker music video,4kFLPrDBzf4
Never Know Phil Fresh music video,UuL5qaKEBwU
Under Your Spell Desire music video,Gcht84HFyko
Oblivion Grimes music video,JtH68PJIQLE
A Real Hero College & Electric Youth music video,-DSVDcw6iW8
Little Dark Age MGMT music video,rtL5oMyBHPs
This Is Home Cavetown music video,2APLh8_ExU0
Pretty Girl Clairo music video,mngtcfcaVrI
Are You Bored Yet? (feat. Clairo) Wallows Clairo music video,wIgmyE5Juzw
Flaming Hot Cheetos Clairo music video,Cqaj4HD8aTc
You Might Be Sleeping Jakob Clairo music video,LSL59cd3m9A
How - demo Clairo music video,vuptWYU6FmY
Silk Sonic Intro Bruno Mars Anderson .Paak Silk Sonic music video,xA5hlB6bScc
Mrs Magic Strawberry Guy music video,a7WgfVB9zys
zombie Max Fry music video,vJsEru14bkw
Four Out Of Five Arctic Monkeys music video,71Es-8FfATo
IN THE DARKNESS DXSTINY HOOL music video,NGFVk71rxeM
Youngest Daughter Superheaven music video,VMk6i7Q0k54
After The Storm Kali Uchis Tyler, The Creator Bootsy Collins music video,9f5zD7ZSNpQ
After The Storm Kali Uchis Tyler, The Creator Bootsy Collins music video,9f5zD7ZSNpQ
After The Storm Kali Uchis Tyler, The Creator Bootsy Collins music video,9f5zD7ZSNpQ
After The Storm Kali Uchis Tyler, The Creator Bootsy Collins music video,9f5zD7ZSNpQ
